{
  "GUNS": {
    "pistol": {"name":"Scav Pistol","tier":0,"dmg":7,"rate":2.6,"spread":0.05,"speed":540,"life":1.1,"col":"#ffe38a","desc":"Never lost. Reliable but weak."},
    "revolver": {"name":"Revolver","tier":1,"dmg":17,"rate":1.4,"spread":0.02,"speed":640,"life":1.2,"col":"#ffd27a","desc":"Heavy single shots."},
    "scatter": {"name":"Scattergun","tier":1,"dmg":5,"rate":1.2,"spread":0.32,"speed":480,"pellets":5,"life":0.6,"col":"#ffb347","desc":"Five pellets. Brutal up close."},
    "repeater": {"name":"Repeater","tier":1,"dmg":4,"rate":7,"spread":0.15,"speed":560,"life":0.9,"col":"#9dffcf","desc":"Sprays fast, low damage per shot."},
    "galefan": {"name":"Gale Fan","tier":1,"dmg":5,"rate":2.2,"spread":0.22,"speed":640,"pellets":3,"life":0.45,"col":"#4fe0c8","elem":"gust","desc":"Three short-range darts that buffet."},
    "carbine": {"name":"Ember Carbine","tier":2,"dmg":7,"rate":1.5,"burst":3,"burstGap":0.08,"spread":0.04,"speed":600,"life":1,"col":"#ff7a3d","elem":"burn","desc":"Three-round bursts that burn."},
    "longbow": {"name":"Longbow","tier":2,"dmg":28,"rate":0.85,"speed":840,"pierce":1,"life":1.4,"col":"#e8d8a8","r":5,"desc":"Slow arrows that pierce one foe."},
    "spore": {"name":"Spore Launcher","tier":2,"dmg":12,"rate":1,"speed":340,"explode":62,"life":0.8,"col":"#e0527a","r":6,"elem":"spore","desc":"Bursting pods that spore an area."},
    "tidecaster": {"name":"Tidecaster","tier":2,"dmg":8,"rate":2,"speed":380,"bounce":2,"life":1.8,"col":"#5cc8ff","r":7,"elem":"soak","desc":"Soaking bubbles that bounce twice."},
    "echorifle": {"name":"Echo Rifle","tier":2,"dmg":11,"rate":1.8,"speed":720,"pierce":2,"life":1.2,"col":"#9b7bff","elem":"static","desc":"Charged shots that pierce two foes."},
    "prism": {"name":"Prism Splitter","tier":3,"dmg":10,"rate":1.6,"speed":520,"split":3,"life":1.1,"col":"#ff8fe0","r":6,"elem":"brittle","desc":"Splits in three and makes foes brittle."},
    "mortar": {"name":"Warden Mortar","tier":3,"dmg":24,"rate":0.65,"speed":300,"explode":95,"life":1,"col":"#e3b04b","r":8,"elem":"stagger","desc":"Big shells that stagger."},
    "hex": {"name":"Hexblaster","tier":3,"dmg":9,"rate":2.2,"speed":300,"homing":3.5,"life":2,"col":"#c27bff","r":6,"elem":"static","desc":"Charged orbs that curve to enemies."},
    "gatling": {"name":"Thunder Gatling","tier":3,"dmg":4,"rate":12,"spread":0.2,"speed":600,"spin":true,"life":0.9,"col":"#7fd7ff","desc":"Spins up to a storm of bullets."},
    "lance": {"name":"Arc Lance","tier":3,"dmg":21,"rate":1.1,"speed":760,"pierce":9,"life":1.3,"col":"#7fd7ff","r":6,"elem":"static","desc":"A charged line that pierces all."},
    "starfall": {"name":"Starfall Staff","tier":4,"dmg":10,"rate":1,"ring":8,"speed":420,"life":1,"col":"#ffe066","r":6,"elem":"brittle","desc":"A ring of eight brittle stars."},
    "dagger": {"name":"Dagger","melee":true,"tier":1,"dmg":11,"rate":3.4,"range":36,"arc":1.3,"col":"#d8d0f0","desc":"Quick stabs. Cuts bullets in a narrow arc."},
    "sword": {"name":"Ironbrand","melee":true,"tier":1,"dmg":18,"rate":2,"range":46,"arc":1.9,"col":"#e8e8f8","desc":"Balanced sword. Cuts bullets in front of you."},
    "spear": {"name":"Pike","melee":true,"tier":2,"dmg":20,"rate":1.6,"range":70,"arc":0.6,"lunge":120,"col":"#c9b48a","desc":"Long thrust that carries you forward."},
    "whip": {"name":"Thornlash","melee":true,"tier":2,"dmg":13,"rate":2.3,"range":84,"arc":0.9,"col":"#7fc85a","elem":"spore","desc":"Long reach that spores foes."},
    "hammer": {"name":"Quake Maul","melee":true,"tier":2,"dmg":34,"rate":0.9,"range":48,"arc":2.3,"knock":40,"shock":70,"col":"#b8862f","elem":"stagger","desc":"Crushing blows that stagger."},
    "scythe": {"name":"Reaper Scythe","melee":true,"tier":3,"dmg":24,"rate":1.4,"range":60,"arc":3.2,"reflect":true,"col":"#9b7bff","desc":"Huge sweep that sends bullets back."},
    "fangs": {"name":"Twin Fangs","melee":true,"tier":3,"dmg":9,"hits":2,"rate":3,"range":38,"arc":1.5,"leech":0.06,"col":"#ff6688","elem":"burn","desc":"Burning double slashes that heal you."},
    "moonblade": {"name":"Moonblade","melee":true,"tier":4,"dmg":26,"rate":1.6,"range":54,"arc":2.4,"wave":true,"reflect":true,"col":"#7fd7ff","elem":"brittle","desc":"Crescent waves that reflect bullets."},
    "needler": {"name":"Bog Needler","tier":1,"dmg":6,"rate":3.2,"spread":0.06,"speed":620,"life":1,"col":"#9be35a","r":4,"elem":"poison","desc":"Fast darts that poison."},
    "harpoon": {"name":"Harpoon Gun","tier":2,"dmg":30,"rate":0.8,"speed":700,"pierce":3,"life":1.2,"col":"#5cc8ff","r":6,"elem":"soak","desc":"Heavy bolts that soak and pierce three foes."},
    "lantern": {"name":"Choir Lantern","tier":2,"dmg":9,"rate":1.6,"speed":330,"homing":2.5,"life":1.8,"col":"#c8a8ff","r":7,"elem":"static","desc":"Slow glowing orbs that seek in the dark."},
    "windbow": {"name":"Windbow","tier":2,"dmg":14,"rate":1.3,"speed":900,"pierce":1,"life":1.2,"col":"#4fe0c8","r":5,"elem":"gust","desc":"Arrows that ride the wind."},
    "bilecannon": {"name":"Bile Cannon","tier":3,"dmg":16,"rate":0.9,"speed":320,"explode":80,"life":0.9,"col":"#9be35a","r":8,"elem":"poison","desc":"Lobbed sacs that splash poison."},
    "slagthrower": {"name":"Slagthrower","tier":3,"dmg":6,"rate":6,"spread":0.25,"speed":360,"life":0.45,"col":"#ff8a3d","r":6,"elem":"burn","desc":"A short gout of molten slag."},
    "tidebreaker": {"name":"Tidebreaker","melee":true,"tier":3,"dmg":28,"rate":1.2,"range":58,"arc":2.6,"knock":30,"shock":60,"col":"#3fa9ff","elem":"soak","desc":"A wave-crested axe that soaks everything it hits."},
    "venomfang": {"name":"Venom Fang","melee":true,"tier":4,"dmg":14,"hits":2,"rate":2.8,"range":40,"arc":1.6,"leech":0.05,"col":"#c8ff6a","elem":"poison","desc":"Twin poisoned fangs that heal you."},
    "sunflare": {"name":"Sunflare Pistol","tier":2,"dmg":9,"rate":2.4,"spread":0.05,"speed":620,"life":1,"col":"#fff3a8","r":5,"elem":"glare","desc":"Bright rounds that dazzle."},
    "halolance": {"name":"Halo Lance","tier":3,"dmg":26,"rate":1,"speed":800,"pierce":6,"life":1.3,"col":"#ffe7c2","r":6,"elem":"glare","desc":"A beam of light that pierces six."},
    "choirbell": {"name":"Choir Bell","tier":3,"dmg":8,"rate":1.2,"ring":10,"speed":300,"life":1.1,"col":"#c8a8ff","r":6,"elem":"static","desc":"Rings out a ring of ten notes."},
    "rootbow": {"name":"Rootbow","tier":3,"dmg":18,"rate":1.4,"speed":700,"pierce":2,"bounce":1,"life":1.4,"col":"#7fd860","r":5,"elem":"spore","desc":"Living arrows that pierce and ricochet."},
    "tethercutter": {"name":"Tethercutter","melee":true,"tier":4,"dmg":30,"rate":1.5,"range":60,"arc":2.8,"reflect":true,"wave":true,"col":"#fff3a8","elem":"glare","desc":"A Keeper blade made to cut tethers."},
    "heartseeker": {"name":"Heartseeker","tier":4,"dmg":16,"rate":2,"speed":420,"homing":4,"split":1,"life":1.8,"col":"#ff5ca8","r":6,"elem":"brittle","desc":"Seeking shards that split on the way."},
    "unboundcannon": {"name":"Unbound Cannon","tier":4,"dmg":40,"rate":0.6,"speed":360,"explode":110,"life":1,"col":"#ff8a3d","r":9,"elem":"burn","desc":"A shell that leaves the floor burning."},
    "keeperstaff": {"name":"Keeper's Staff","tier":4,"dmg":12,"rate":1.6,"speed":360,"homing":2,"pierce":2,"life":2,"col":"#9fe8ff","r":7,"elem":"soak","desc":"The old Keepers' tool, still wet from the Spring."}
  },
  "WEAPON_COST": {
    "1": {"coin":60,"ore":4},
    "2": {"coin":110,"ore":8},
    "3": {"coin":180,"ore":14},
    "4": {"coin":320,"ore":26}
  },
  "SCRAP_ORE": [
    0,
    3,
    6,
    10,
    16
  ],
  "DONATE_PTS": [
    0,
    10,
    25,
    55,
    100
  ],
  "BUFFS": {
    "dmg": {"name":"Sharpened Edge","desc":"+15% weapon damage"},
    "rate": {"name":"Hair Trigger","desc":"+15% attack speed"},
    "speed": {"name":"Swift Boots","desc":"+12% move speed"},
    "hp": {"name":"Heartstone","desc":"+25 max HP and heal 25"},
    "pdmg": {"name":"Pack Fury","desc":"Companions deal 20% more damage"},
    "ptough": {"name":"Pack Hide","desc":"Companions take 20% less damage"},
    "cage": {"name":"Wide Snare","desc":"+40% cage radius, +10% capture chance"},
    "roll": {"name":"Featherstep","desc":"Roll recharges 35% faster"},
    "leech": {"name":"Leech Charm","desc":"Heal 1 HP for every 25 damage you deal"},
    "pierce": {"name":"Drill Tips","desc":"Your shots pierce one more enemy"},
    "abil": {"name":"Quick Bond","desc":"Companion abilities recharge 25% faster"},
    "greed": {"name":"Greedy Eye","desc":"+30% coin found"},
    "time": {"name":"Hourglass Shard","desc":"+60 seconds on the raid clock"}
  }
}
